CodeDiplome;Intitulé Diplôme;CodeRNCP;Niveau2019;type Diplôme;DerniereMaJ
1022001;AGENT DE CONTROLE NON DESTRUCTIF (MC NIVEAU IV);RNCP955;niveau4;MC4;v1.0
1022103;EMPLOYE TRAITEUR (MC NIVEAU V);RNCP958;niveau3;MC5;v1.0
1022104;PATISSERIE, GLACERIE, CHOCOLATERIE, CONFISERIE SPECIALISEES (MC NIVEAU V);RNCP6895;niveau3;MC5;v1.0
1022105;CUISINIER EN DESSERTS DE RESTAURANT (MC NIVEAU V);RNCP6981;niveau3;MC5;v1.0
1022106;VENDEUR SPECIALISE EN ALIMENTATION (MC NIVEAU V);RNCP742;niveau3;MC5;v1.0
1022107;BOULANGERIE SPECIALISEE (MC NIVEAU V);RNCP701;niveau3;MC5;v1.0
1022108;PATISSERIE BOULANGERE (MC5);RNCP2444;niveau3;MC5;v1.0
1022109;ART DE LA CUISINE ALLEGEE (MC NIVEAU V);RNCP4083;niveau3;MC5;v1.0
1022110;PATISSERIE, GLACERIE, CHOCOLATERIE, CONFISERIE SPECIALISEES (MC NIVEAU V);RNCP6895;niveau3;MC5;v1.0
1022304;JOAILLERIE (MC NIVEAU V);RNCP832;niveau3;MC5;v1.0
1022405;CONDUCTEUR DE MACHINES DE VERRERIE (MC NIVEAU V);RNCP723;niveau3;MC5;v1.0
1022701;MAINTENANCE EN EQUIPEMENT THERMIQUE INDIVIDUEL (MC NIVEAU V);RNCP730;niveau3;MC5;v1.0
1022703;TECHNICIEN(NE)  DES SERVICES A L'ENERGIE (NIVEAU IV);RNCP9154;niveau4;MC4;v1.0
1022704;TECHNICIEN EN ENERGIES RENOUVELABLES OPTION A ENERGIE ELECTRIQUE (MC NIVEAU IV);RNCP15009;niveau4;MC4;v1.0
1022705;TECHNICIEN EN ENERGIES RENOUVELABLES OPTION B ENERGIE THERMIQUE (MC NIVEAU IV);RNCP15009;niveau4;MC4;v1.0
1023202;ZINGUERIE (MC NIVEAU V);RNCP744;niveau3;MC5;v1.0
1023302;PLAQUISTE (MC NIVEAU V);RNCP740;niveau3;MC5;v1.0
1023304;PEINTURE DECORATION (MC NIVEAU IV);RNCP738;niveau4;MC4;v1.0
1023306;VENDEUR-CONSEIL EN PRODUITS TECHNIQUES POUR L'HABITAT (MC NIVEAU IV);RNCP21466;niveau4;MC4;v1.0
1023403;PARQUETEUR (MC NIVEAU V);RNCP1133;niveau3;MC5;v1.0
1024201;ESSAYAGE-RETOUCHE-VENTE (MC NIVEAU V);RNCP1140;niveau3;MC5;v1.0
1024202;DECORS TEXTILES PERMANENTS ET EPHEMERES (MC NIVEAU V);RNCP5632;niveau3;MC5;v1.0
1024301;PIQUAGE D'ARTICLES CHAUSSANTS (MC NIVEAU V);RNCP739;niveau3;MC5;v1.0
1025002;TECHNICIEN(NE) ASCENSORISTE (SERVICE ET MODERNISATION) (MC NIVEAU IV);RNCP4105;niveau4;MC4;v1.0
1025003;MECATRONIQUE NAVALE (MC NIVEAU IV);RNCP24921;niveau4;MC4;v1.0
1025118;REALISATION DE CIRCUITS OLEOHYDRAULIQUES ET PNEUMATIQUES (MC NIVEAU V);RNCP862;niveau3;MC5;v1.0
1025122;MAQUETTES ET PROTOTYPES (MC NIVEAU IV);RNCP879;niveau4;MC4;v1.0
1025123;MAINTENANCE DES INSTALLATIONS OLEOHYDRAULIQUES ET PNEUMATIQUES (MC NIVEAU IV);RNCP880;niveau4;MC4;v1.0
1025207;MAINTENANCE DES MOTEURS DIESEL ET DE LEURS EQUIPEMENTS (MC NIVEAU V);RNCP865;niveau3;MC5;v1.0
1025308;AERONAUTIQUE OPTION AVIONS A MOTEURS A TURBINES (MC NIVEAU IV);RNCP29138;niveau4;MC4;v1.0
1025309;AERONAUTIQUE OPTION AVIONS A MOTEURS A PISTONS (MC NIVEAU IV);RNCP29136;niveau4;MC4;v1.0
1025310;AERONAUTIQUE OPTION HELICOPTERES A MOTEURS A TURBINES (MC NIVEAU IV);RNCP29140;niveau4;MC4;v1.0
1025311;AERONAUTIQUE OPTION HELICOPTERES A MOTEURS A PISTONS (MC NIVEAU IV);RNCP29139;niveau4;MC4;v1.0
1025312;AERONAUTIQUE OPTION AVIONIQUE (MC NIVEAU IV);RNCP1154;niveau4;MC4;v1.0
1025312;AERONAUTIQUE OPTION AVIONIQUE (MC NIVEAU IV);RNCP29133;niveau4;MC4;v1.0
1025406;TECHNICIEN(NE) EN SOUDAGE (MC NIVEAU IV);RNCP24919;niveau4;MC4;v1.0
1025407;TECHNICIEN(NE) EN TUYAUTERIE (MC NIVEAU IV);RNCP27473;niveau4;MC4;v1.0
1025408;TECHNICIEN(NE) EN CHAUDRONNERIE AERONAUTIQUE ET SPATIALE (MC NIVEAU IV);NR;niveau7;MC4;v1.0
1025409;TECHNICIEN EN PEINTURE AERONAUTIQUE (MC NIVEAU IV);NR;niveau4;MC4;v1.1
1025507;MAINTENANCE DES SYSTEMES EMBARQUES DE l'AUTOMOBILE (MC NIVEAU V);RNCP2807;niveau3;MC5;v1.0
1025508;TECHNICIEN(NE) EN RESEAUX ELECTRIQUES (MC NIVEAU IV);RNCP13937;niveau4;MC4;v1.0
1031101;ACCUEIL DANS LES TRANSPORTS (MC NIVEAU IV);RNCP953;niveau4;MC4;v1.0
1031102;AGENT TRANSPORT EXPLOITATION FERROVIAIRE (MC NIVEAU IV);RNCP956;niveau4;MC4;v1.0
1031201;ASSISTANCE, CONSEIL, VENTE A DISTANCE (MC NIVEAU IV);RNCP1173;niveau4;MC4;v1.0
1031301;SERVICES FINANCIERS (MC NIVEAU IV);RNCP852;niveau4;MC4;v1.0
1033001;AIDE A DOMICILE (MC NIVEAU V);RNCP718;niveau3;MC5;v1.0
1033410;SOMMELLERIE (MC NIVEAU V);RNCP6985;niveau3;MC5;v1.0
1033411;EMPLOYE BARMAN (MC NIVEAU V);RNCP6984;niveau3;MC5;v1.0
1033412;ORGANISATEUR DE RECEPTION (MC NIVEAU IV);RNCP3138;niveau4;MC4;v1.0
1033413;ACCUEIL-RECEPTION (MC NIVEAU IV);RNCP6926;niveau4;MC4;v1.0
1033501;ANIMATION-GESTION DE PROJETS DANS LE SECTEUR SPORTIF (MC NIVEAU IV);RNCP30833;niveau4;MC4;v1.0
1033605;COIFFURE COUPE COULEUR (MC NIVEAU V);RNCP29025;niveau3;MC5;v1.0
1034201;ENTRETIEN DES COLLECTIONS DU PATRIMOINE (MC NIVEAU V);RNCP5638;niveau3;MC5;v1.0
1034401;SURETE DES ESPACES OUVERTS AU PUBLIC (MC NIVEAU V);RNCP1177;niveau3;MC5;v1.0
1034402;SECURITE CIVILE ET D'ENTREPRISE (MC NIVEAU V);RNCP853;niveau3;MC5;v1.0
10033101;DE DOCTEUR EN PHARMACIE;NR;niveau8;DOCTORAT;v1.0
13511005;CHIMIE (MASTER NANTES);RNCP31803;niveau7;MASTER PRO;v1.0
13511006;SCIENCES DE L'EAU (MASTER LYON 2);RNCP34097;niveau7;MASTER PRO;v1.0
13511007;SCIENCES DE L'EAU (MASTER TOURS);RNCP34097;niveau7;MASTER PRO;v1.0
13511008;SCIENCES DE LA MER (MASTER);NR;niveau7;MASTER PRO;v1.0
13511009;ERGONOMIE (MASTER);RNCP31807;niveau7;MASTER PRO;v1.0
13511010;APPROCHES INTERDISCIPLINAIRES DE LA RECHERCHE ET DE L'ENSEIGNEMENT (MASTER);RNCP34218;niveau7;MASTER PRO;v1.1
13511011;SCIENCES POUR L'ENVIRONNEMENT (MASTER);RNCP34134;niveau7;MASTER PRO;v1.1
13511102;SCIENCES ET GENIE DES MATERIAUX (MASTER VALENCIENNES);RNCP32137;niveau7;MASTER PRO;v1.0
13511107;SCIENCES ET GENIE DES MATERIAUX (MASTER PARIS SACLAY);RNCP32137;niveau7;MASTER PRO;v1.0
13511108;CHIMIE PHYSIQUE ET ANALYTIQUE (MASTER);RNCP31488;niveau7;MASTER PRO;v1.0
13511109;CHIMIE (MASTER GRENOBLE ALPES);RNCP31803;niveau7;MASTER PRO;v1.0
13511202;CHIMIE (MASTER STRASBOURG);RNCP31803;niveau7;MASTER PRO;v1.0
13511203;CHIMIE (MASTER PARIS 12);RNCP31803;niveau7;MASTER PRO;v1.0
13511204;CHIMIE MOLECULAIRE (MASTER COMUE COTE D'AZUR);RNCP32150;niveau7;MASTER PRO;v1.0
13511205;BIOTECHNOLOGIES (MASTER);RNCP34037;niveau7;MASTER PRO;v1.1
13511301;GEORESSOURCES, GEORISQUES, GEOTECHNIQUE (MASTER);RNCP34099;niveau7;MASTER PRO;v1.0
13511302;SCIENCES DE L'OCEAN, DE L'ATMOSPHERE ET DU CLIMAT (MASTER);RNCP34093;niveau7;MASTER PRO;v1.0
13511303;BIODIVERSITE , ECOLOGIE, EVOLUTION (MASTER PARIS SACLAY);RNCP34154;niveau7;MASTER PRO;v1.0
13511304;AGROSCIENCES, ENVIRONNEMENT, TERRITOIRES, PAYSAGE, FORET (MASTER);RNCP34156;niveau7;MASTER PRO;v1.1
13511305;SCIENCES ET TECHNOLOGIES DE L'AGRICULTURE, DE L'ALIMENTATION ET DE L'ENVIRONNEMENT (MASTER);NR;niveau7;MASTER PRO;v1.0
13511306;SCIENCES DE L'EAU (MASTER);RNCP34097;niveau7;MASTER PRO;v1.0
13511401;ACTUARIAT (MARNE LA VALLEE);RNCP31505;niveau7;MASTER PRO;v1.0
13511404;MATHEMATIQUES, INFORMATIQUE, DECISION ET ORGANISATION (MIDO) : MATHEMATIQUES APPLIQUEES (MASTER DAUPHINE);RNCP34220;niveau7;MASTER PRO;v1.0
13511406;INFORMATIQUE (MASTER AVIGNON);RNCP34126;niveau7;MASTER PRO;v1.0
13511408;ACTUARIAT (MASTER STRASBOURG);RNCP31505;niveau7;MASTER PRO;v1.0
13511409;ACTUARIAT (MASTER LE MANS);RNCP31505;niveau7;MASTER PRO;v1.0
13511410;MATHEMATIQUES ET INFORMATIQUE APPLIQUEES AUX SCIENCES HUMAINES ET SOCIALES -MIASHS (MASTER MONTPELLIER 3);RNCP34220;niveau7;MASTER PRO;v1.0
13511412;MATHEMATIQUES ET INFORMATIQUE APPLIQUEES AUX SCIENCES HUMAINES ET SOCIALES -MIASHS (MASTER ANGERS);RNCP34220;niveau7;MASTER PRO;v1.0
13511413;MATHEMATIQUES ET APPLICATIONS (MASTER COMUE COTE D'AZUR);RNCP34274;niveau7;MASTER PRO;v1.0
13511415;MATHEMATIQUES ET APPLICATIONS (MASTER ANGERS);RNCP34274;niveau7;MASTER PRO;v1.0
13511416;MATHEMATIQUES ET APPLICATIONS (MASTER);RNCP34274;niveau7;MASTER PRO;v1.0
13511417;MATHEMATIQUES APPLIQUEES, STATISTIQUE (MASTER);RNCP34039;niveau7;MASTER PRO;v1.0
13511508;PHYSIQUE FONDAMENTALE ET APPLICATIONS (MASTER BORDEAUX);RNCP31808;niveau7;MASTER PRO;v1.0
13511510;PHYSIQUE (MASTER);NR;niveau7;MASTER PRO;v1.0
13511511;PHYSIQUE APPLIQUEE ET INGENIERIE PHYSIQUE (MASTER ORLEANS);NR;niveau7;MASTER PRO;v1.0
13511512;PHYSIQUE APPLIQUEE ET INGENIERIE PHYSIQUE (MASTER LIMOGES);RNCP27144;niveau7;MASTER PRO;v1.0
13511513;PHYSIQUE FONDAMENTALE ET APPLICATIONS (MASTER TOULOUSE 3);RNCP31808;niveau7;MASTER PRO;v1.0
13511514;MECANIQUE (MASTER LORRAINE);RNCP34069;niveau7;MASTER PRO;v1.0
13511515;NANOSCIENCES ET NANOTECHNOLOGIES (MASTER);RNCP31502;niveau7;MASTER PRO;v1.0
13511516;PHYSIQUE APPLIQUEE ET INGENIERIE PHYSIQUE (MASTER);NR;niveau7;MASTER PRO;v1.0
13511517;PHYSIQUE FONDAMENTALE ET APPLICATIONS (MASTER);RNCP31808;niveau7;MASTER PRO;v1.0
13511602;CHIMIE ET SCIENCES DES MATERIAUX (MASTER EVRY);RNCP34112;niveau7;MASTER PRO;v1.1
13511607;CHIMIE (MASTER LYON 1);RNCP31803;niveau7;MASTER PRO;v1.0
13511608;CHIMIE (MASTER ANGERS);RNCP31803;niveau7;MASTER PRO;v1.0
13511609;CHIMIE (MASTER CHAMBERY);RNCP31803;niveau7;MASTER PRO;v1.0
13511610;CHIMIE (MASTER POITIERS);RNCP31803;niveau7;MASTER PRO;v1.0
13511611;CHIMIE (MASTER LORRAINE);RNCP31803;niveau7;MASTER PRO;v1.0
13511612;CHIMIE (MASTER BESANCON);RNCP31803;niveau7;MASTER PRO;v1.0
13511613;CHIMIE (MASTER LIMOGES);RNCP31803;niveau7;MASTER PRO;v1.0
13511614;CHIMIE (MASTER);RNCP31803;niveau7;MASTER PRO;v1.0
13511615;CHIMIE MOLECULAIRE (MASTER);RNCP32150;niveau7;MASTER PRO;v1.0
13511704;RISQUES ET ENVIRONNEMENT (MASTER CORSE);RNCP34070;niveau7;MASTER PRO;v1.0
13511709;SCIENCES DE LA TERRE ET DES PLANETES, ENVIRONNEMENT (MASTER PARIS SACLAY);RNCP31500;niveau7;MASTER PRO;v1.0
13511710;SCIENCES DE LA TERRE ET DES PLANETES, ENVIRONNEMENT (MASTER);RNCP31500;niveau7;MASTER PRO;v1.0
13511801;BIO-INFORMATIQUE (MASTER);RNCP34129;niveau7;MASTER PRO;v1.0
13511806;INGENIERIE DE LA SANTE (MASTER POITIERS);RNCP34075;niveau7;MASTER PRO;v1.0
13511807;BIODIVERSITE , ECOLOGIE, EVOLUTION (MASTER MONTPELLIER);RNCP34154;niveau7;MASTER PRO;v1.0
13511813;SCIENCES DU VIVANT (MASTER);RNCP34110;niveau7;MASTER PRO;v1.1
13511814;SCIENCES DE L'EAU (MASTER MONTPELLIER);RNCP34097;niveau7;MASTER PRO;v1.0
13511817;BIODIVERSITE, ECOLOGIE ET EVOLUTION (MASTER TOURS);RNCP34154;niveau7;MASTER PRO;v1.0
13511818;BIODIVERSITE, ECOLOGIE ET EVOLUTION (MASTER POITIERS);RNCP34154;niveau7;MASTER PRO;v1.0
13511819;BIOLOGIE VEGETALE (MASTER);RNCP31802;niveau7;MASTER PRO;v1.0
13511820;NEUROSCIENCES (MASTER);RNCP34152;niveau7;MASTER PRO;v1.0
13511821;BIOLOGIE INTEGRATIVE ET PHYSIOLOGIE (MASTER);RNCP34271;niveau7;MASTER PRO;v1.0
13511822;BIODIVERSITE, ECOLOGIE ET EVOLUTION (MASTER);RNCP34154;niveau7;MASTER PRO;v1.0
13511823;BIOLOGIE MOLECULAIRE ET CELLULAIRE (MASTER);RNCP34272;niveau7;MASTER PRO;v1.0
13512005;URBANISME ET AMENAGEMENT (MASTER PERPIGNAN);RNCP31470;niveau7;MASTER PRO;v1.0
13512006;SCIENCES DES ORGANISATIONS (DROIT, ECONOMIE, GESTION, SCIENCES SOCIALES) : ACTIONS PUBLIQUES ET REGULATIONS SOCIALES (MASTER DAUPHINE);NR;niveau7;MASTER PRO;v1.0
13512007;ETUDES EUROPEENNES ET INTERNATIONALES (MASTER);RNCP34133;niveau7;MASTER PRO;v1.0
13512008;VILLE ET ENVIRONNEMENTS URBAINS (MASTER);RNCP31450;niveau7;MASTER PRO;v1.0
13512009;ETUDES SUR LE GENRE (MASTER);RNCP31494;niveau7;MASTER PRO;v1.0
13512010;ADMINISTRATION ECONOMIQUE ET SOCIALE (MASTER);RNCP34081;niveau7;MASTER PRO;v1.0
13512011;RELATIONS INTERNATIONALES (MASTER);NR;niveau7;MASTER PRO;v1.0
13512104;GEOGRAPHIE, AMENAGEMENT, ENVIRONNEMENT ET DEVELOPPEMENT (MASTER PARIS 8);RNCP34074;niveau7;MASTER PRO;v1.0
13512105;GEOMATIQUE (MASTER);NR;niveau7;MASTER PRO;v1.0
13512107;GEOGRAPHIE, AMENAGEMENT, ENVIRONNEMENT ET DEVELOPPEMENT (MASTER BESANCON);RNCP34074;niveau7;MASTER PRO;v1.0
13512108;GEOGRAPHIE, AMENAGEMENT, ENVIRONNEMENT ET DEVELOPPEMENT (MASTER DIJON);RNCP34074;niveau7;MASTER PRO;v1.0
13512109;GEOGRAPHIE (MASTER);RNCP34074;niveau7;MASTER PRO;v1.1
13512110;GEOGRAPHIE, AMENAGEMENT, ENVIRONNEMENT ET DEVELOPPEMENT (MASTER);RNCP34074;niveau7;MASTER PRO;v1.0
13512201;ECONOMIE DES ORGANISATIONS (MASTER GRENOBLE ALPES);RNCP34226;niveau7;MASTER PRO;v1.0
13512211;ECONOMIE SOCIALE ET SOLIDAIRE (MASTER MULHOUSE);NR;niveau7;MASTER PRO;v1.0
13512216;ECONOMIE DE L'ENVIRONNEMENT, DE L'ENERGIE ET DES TRANSPORTS (MASTER);RNCP34221;niveau7;MASTER PRO;v1.0
13512218;INNOVATION, ENTREPRISE ET SOCIETE (MASTER PARIS SACLAY);RNCP24782;niveau7;MASTER PRO;v1.0
13512219;ECONOMIE APPLIQUEE (MASTER PARIS 12);RNCP34428;niveau7;MASTER PRO;v1.0
13512220;INTELLIGENCE ECONOMIQUE (MASTER POITIERS);RNCP34077;niveau7;MASTER PRO;v1.0
13512224;INTELLIGENCE ECONOMIQUE (MASTER MARNE LA VALLEE);RNCP34077;niveau7;MASTER PRO;v1.0
13512225;ECONOMIE INTERNATIONALE (MASTER);NR;niveau7;MASTER PRO;v1.0
13512226;ANALYSE ET POLITIQUE ECONOMIQUE (MASTER SAINT ETIENNE);RNCP34424;niveau7;MASTER PRO;v1.0
13512227;ECONOMIE DES ORGANISATIONS (MASTER COMUE COTE D'AZUR);RNCP34226;niveau7;MASTER PRO;v1.0
13512228;ECONOMETRIE, STATISTIQUES (MASTER TOULOUSE 1);RNCP34294;niveau7;MASTER PRO;v1.0
13512232;ECONOMIE DU DEVELOPPEMENT (MASTER);RNCP34440;niveau7;MASTER PRO;v1.0
13512233;ANALYSE ET POLITIQUE ECONOMIQUE (MASTER);RNCP34424;niveau7;MASTER PRO;v1.0
13512234;ECONOMETRIE, STATISTIQUES (MASTER);RNCP34294;niveau7;MASTER PRO;v1.0
13512235;ECONOMIE DE L'ENTREPRISE ET DES MARCHES (MASTER);RNCP34292;niveau7;MASTER PRO;v1.0
13512236;ECONOMIE ET MANAGEMENT PUBLICS (MASTER);NR;niveau7;MASTER PRO;v1.0
13512237;ECONOMIE APPLIQUEE (MASTER);RNCP34428;niveau7;MASTER PRO;v1.0
13512238;ECONOMIE DES ORGANISATIONS (MASTER);RNCP34226;niveau7;MASTER PRO;v1.0
13512302;SCIENCES DE L'EDUCATION (MASTER STRASBOURG);RNCP31849;niveau7;MASTER PRO;v1.1
13512303;INFORMATION, COMMUNICATION (MASTER CORSE);RNCP31496;niveau7;MASTER PRO;v1.0
13512305;DEMOGRAPHIE (MASTER);NR;niveau7;MASTER PRO;v1.0
13512306;SOCIOLOGIE (MASTER NANTES);RNCP31499;niveau7;MASTER PRO;v1.0
13512307;SCIENCES SOCIALES (MASTER MARNE LA VALLEE);RNCP34296;niveau7;MASTER PRO;v1.1
13512308;SOCIOLOGIE (MASTER PARIS SACLAY);RNCP31499;niveau7;MASTER PRO;v1.0
13512310;SOCIOLOGIE (MASTER CHAMBERY);RNCP31499;niveau7;MASTER PRO;v1.0
13512311;SCIENCES SOCIALES (MASTER BORDEAUX);RNCP34296;niveau7;MASTER PRO;v1.1
13512312;SCIENCES DE L'EDUCATION (MASTER DIJON);RNCP31849;niveau7;MASTER PRO;v1.1
13512313;SCIENCES SOCIALES (MASTER);RNCP34296;niveau7;MASTER PRO;v1.1
13512314;SOCIOLOGIE (MASTER);RNCP31499;niveau7;MASTER PRO;v1.0
13512401;PSYCHOLOGIE SOCIALE, DU TRAVAIL ET DES ORGANISATIONS (MASTER MONTPELLIER 3);RNCP31811;niveau7;MASTER PRO;v1.0
13512402;PSYCHOLOGIE SOCIALE, DU TRAVAIL ET DES ORGANISATIONS (MASTER STRASBOURG);RNCP31811;niveau7;MASTER PRO;v1.0
13512403;PSYCHOLOGIE (MASTER POITIERS);RNCP32277;niveau7;MASTER PRO;v1.1
13512404;PSYCHOLOGIE (MASTER DIJON);RNCP32277;niveau7;MASTER PRO;v1.1
13512405;PSYCHOLOGIE (MASTER);RNCP32277;niveau7;MASTER PRO;v1.1
13512406;SCIENCES COGNITIVES (MASTER);RNCP34433;niveau7;MASTER PRO;v1.1
13512407;PSYCHOLOGIE SOCIALE, DU TRAVAIL ET DES ORGANISATIONS (MASTER);RNCP31811;niveau7;MASTER PRO;v1.0
13512504;DIDACTIQUE DES LANGUES (MASTER);NR;niveau7;MASTER PRO;v1.0
13512601;HISTOIRE (MASTER MARNE LA VALLEE);RNCP24430;niveau7;MASTER PRO;v1.0
13512604;HISTOIRE (MASTER ORLEANS);RNCP24430;niveau7;MASTER PRO;v1.0
13512605;HISTOIRE, CIVILISATIONS, PATRIMOINE (MASTER);RNCP34096;niveau7;MASTER PRO;v1.1
13512606;HISTOIRE (MASTER);RNCP24430;niveau7;MASTER PRO;v1.0
13512607;ARCHEOLOGIE, SCIENCES POUR L'ARCHEOLOGIE (MASTER);RNCP31490;niveau7;MASTER PRO;v1.0
13512701;PHILOSOPHIE (MASTER);NR;niveau7;MASTER PRO;v1.1
13512807;DROIT EUROPEEN (MASTER);RNCP34109;niveau7;MASTER PRO;v1.0
13512808;DROIT PUBLIC (MASTER CERGY);RNCP34084;niveau7;MASTER PRO;v1.0
1351280A;DROIT DES AFFAIRES (MASTER BESANCON);RNCP34127;niveau7;MASTER PRO;v1.0
1351280B;DROIT DES COLLECTIVITES TERRITORIALES (MASTER CORSE);RNCP34087;niveau7;MASTER PRO;v1.0
1351280C;DROIT DES AFFAIRES (MASTER TOULOUSE 1);RNCP34127;niveau7;MASTER PRO;v1.0
1351280D;DROIT DE L'ENTREPRISE (MASTER TOURS);RNCP34225;niveau7;MASTER PRO;v1.0
1351280E;DROIT DE L'ENVIRONNEMENT ET DE L'URBANISME (MASTER TOURS);RNCP34080;niveau7;MASTER PRO;v1.0
1351280F;DROIT PUBLIC (MASTER TOURS);RNCP34084;niveau7;MASTER PRO;v1.0
1351280G;DROIT PUBLIC (MASTER ORLEANS);RNCP34084;niveau7;MASTER PRO;v1.0
1351280H;JUSTICE, PROCES ET PROCEDURES (MASTER TOURS);RNCP34098;niveau7;MASTER PRO;v1.0
1351280J;DROIT (MASTER MULHOUSE);RNCP34108;niveau7;MASTER PRO;v1.1
1351280K;DROIT DES AFFAIRES (MASTER STRASBOURG);RNCP34127;niveau7;MASTER PRO;v1.0
1351280L;DROIT DE L'ENTREPRISE (MASTER MONTPELLIER);RNCP34225;niveau7;MASTER PRO;v1.0
1351280M;DROIT DES COLLECTIVITES TERRITORIALES (MASTER);RNCP34087;niveau7;MASTER PRO;v1.0
1351280N;JUSTICE, PROCES ET PROCEDURES (MASTER);RNCP34098;niveau7;MASTER PRO;v1.0
1351280P;DROIT PUBLIC (MASTER CLERMONT AUVERGNE);RNCP34084;niveau7;MASTER PRO;v1.0
1351280Q;DROIT NOTARIAL (MASTER);RNCP34124;niveau7;MASTER PRO;v1.0
13512810;DROIT DE LA SANTE (MASTER MONTPELLIER);RNCP31492;niveau7;MASTER PRO;v1.0
13512815;DROIT, ECONOMIE, GESTION : DROIT DES ASSURANCES (MASTER PARIS 12);NR;niveau7;MASTER PRO;v1.0
1351281A;DROIT DES AFFAIRES (MASTER AIX MARSEILLE);RNCP34127;niveau7;MASTER PRO;v1.0
1351281B;DROIT PRIVE (MASTER COMUE COTE D'AZUR);RNCP34123;niveau7;MASTER PRO;v1.0
1351281C;DROIT DU NUMERIQUE (MASTER);RNCP34089;niveau7;MASTER PRO;v1.0
1351281D;DROIT PUBLIC (MASTER LA REUNION);RNCP34084;niveau7;MASTER PRO;v1.0
1351281E;DROIT DES AFFAIRES (MASTER LORRAINE);RNCP34127;niveau7;MASTER PRO;v1.0
1351281F;DROIT PUBLIC (MASTER BORDEAUX);RNCP34084;niveau7;MASTER PRO;v1.0
1351281G;DROIT PUBLIC (MASTER PAU);RNCP34084;niveau7;MASTER PRO;v1.0
1351281H;DROIT DE L'ENTREPRISE (MASTER BESANCON);RNCP34225;niveau7;MASTER PRO;v1.0
1351281J;DROIT DE L'ENTREPRISE (MASTER);RNCP34225;niveau7;MASTER PRO;v1.0
1351281K;DROIT PUBLIC (MASTER);RNCP34084;niveau7;MASTER PRO;v1.0
1351281L;DROIT DES AFFAIRES (MASTER);RNCP34127;niveau7;MASTER PRO;v1.0
1351281M;DROIT PRIVE (MASTER);RNCP34123;niveau7;MASTER PRO;v1.0
1351281N;DROIT (MASTER);RNCP34108;niveau7;MASTER PRO;v1.1
1351281P;DROIT SOCIAL (MASTER);RNCP31493;niveau7;MASTER PRO;v1.0
1351281R;DROIT DES ASSURANCES (MASTER);NR;niveau7;MASTER PRO;v1.0
1351281S;DROIT BANCAIRE ET FINANCIER (MASTER);RNCP34072;niveau7;MASTER PRO;v1.0
1351281T;DROIT DE L'IMMOBILIER (MASTER);RNCP34105;niveau7;MASTER PRO;v1.0
1351281U;DROIT DU PATRIMOINE (MASTER);RNCP34085;niveau7;MASTER PRO;v1.1
1351281W;DROIT FISCAL (MASTER);RNCP34122;niveau7;MASTER PRO;v1.0
1351281X;DROIT PUBLIC DES AFFAIRES (MASTER);RNCP34153;niveau7;MASTER PRO;v1.0
1351281Y;DROIT DE LA SANTE (MASTER);RNCP31492;niveau7;MASTER PRO;v1.0
1351281Z;DROIT DE L'ENVIRONNEMENT ET DE L'URBANISME (MASTER);RNCP34080;niveau7;MASTER PRO;v1.0
13512821;SCIENCE POLITIQUE (MASTER VERSAILLES);RNCP31506;niveau7;MASTER PRO;v1.0
13512823;DROIT SOCIAL (MASTER ORLEANS);RNCP31493;niveau7;MASTER PRO;v1.0
13512826;DROIT DES ASSURANCES (MASTER LA ROCHELLE);NR;niveau7;MASTER PRO;v1.0
13512828;DROIT ADMINISTRATIF (MASTER VERSAILLES);NR;niveau7;MASTER PRO;v1.0
1351282A;SCIENCE POLITIQUE (MASTER);RNCP31506;niveau7;MASTER PRO;v1.0
13512833;DROIT DE L'ENVIRONNEMENT ET DE L'URBANISME (MASTER PERPIGNAN);RNCP34080;niveau7;MASTER PRO;v1.0
13512835;DROIT SOCIAL (MASTER TOULOUSE 1);RNCP31493;niveau7;MASTER PRO;v1.0
13512836;SCIENCES DES ORGANISATIONS (DROIT, ECONOMIE, GESTION, SCIENCES SOCIALES) : DROIT (MASTER DAUPHINE);NR;niveau7;MASTER PRO;v1.0
13512837;DROIT INTERNATIONAL (MASTER GRENOBLE ALPES);RNCP34128;niveau7;MASTER PRO;v1.0
13512838;DROIT PUBLIC DES AFFAIRES (MASTER POITIERS);RNCP34153;niveau7;MASTER PRO;v1.0
13512845;DROIT DU PATRIMOINE (MASTER AMIENS);RNCP34085;niveau7;MASTER PRO;v1.1
13512856;DROIT SOCIAL (MASTER NANTES);RNCP31493;niveau7;MASTER PRO;v1.0
13512858;DROIT, ECONOMIE, GESTION : DROIT DES AFFAIRES (MASTER LILLE 2);RNCP34127;niveau7;MASTER PRO;v1.0
13512859;DROIT PUBLIC (MASTER AIX MARSEILLE);RNCP34084;niveau7;MASTER PRO;v1.0
13512861;FINANCES PUBLIQUES (MASTER MONTPELLIER);RNCP24536;niveau7;MASTER PRO;v1.0
13512869;DROIT, ECONOMIE, GESTION : DROIT PRIVE (MASTER CERGY);RNCP34123;niveau7;MASTER PRO;v1.0
13512870;DROIT SOCIAL (MASTER STRASBOURG);RNCP31493;niveau7;MASTER PRO;v1.0
13512873;DROIT SOCIAL (MASTER PARIS SACLAY);RNCP31493;niveau7;MASTER PRO;v1.0
13512874;DROIT DE LA SANTE (MASTER PARIS SACLAY);RNCP31492;niveau7;MASTER PRO;v1.0
13512876;DROIT, ECONOMIE, GESTION : DROIT DES AFFAIRES (MASTER CERGY);RNCP34127;niveau7;MASTER PRO;v1.0
13512877;DROIT, ECONOMIE, GESTION : DROIT DU PATRIMOINE (MASTER MONTPELLIER);RNCP34085;niveau7;MASTER PRO;v1.1
13512878;DROIT, ECONOMIE, GESTION : DROIT DES AFFAIRES (MASTER PARIS SACLAY);RNCP34127;niveau7;MASTER PRO;v1.0
13512879;DROIT PUBLIC (MASTER REIMS);RNCP34084;niveau7;MASTER PRO;v1.0
13512881;DROIT SOCIAL (MASTER LYON 2);RNCP31493;niveau7;MASTER PRO;v1.0
13512884;DROIT DES AFFAIRES (MASTER POITIERS);RNCP34127;niveau7;MASTER PRO;v1.0
13512885;DROIT, ECONOMIE, GESTION : DROIT DES AFFAIRES (MASTER SAINT ETIENNE);RNCP34127;niveau7;MASTER PRO;v1.0
13512886;DROIT PUBLIC DES AFFAIRES (MASTER MONTPELLIER);RNCP34153;niveau7;MASTER PRO;v1.0
13512887;SCIENCE POLITIQUE (MASTER MONTPELLIER);RNCP31506;niveau7;MASTER PRO;v1.0
13512888;DROIT PUBLIC (MASTER CHAMBERY);RNCP34084;niveau7;MASTER PRO;v1.0
13512889;DROIT, ECONOMIE, GESTION : DROIT PRIVE (MASTER MONTPELLIER);RNCP34123;niveau7;MASTER PRO;v1.0
13512890;DROIT, ECONOMIE, GESTION : DROIT DES AFFAIRES (MASTER VALENCIENNES);RNCP34127;niveau7;MASTER PRO;v1.0
13512893;DROIT PUBLIC (MASTER PARIS SACLAY);RNCP34084;niveau7;MASTER PRO;v1.0
13512894;DROIT PRIVE (MASTER CLERMONT AUVERGNE);RNCP34123;niveau7;MASTER PRO;v1.0
13512895;RELATIONS INTERNATIONALES (MASTER AIX MARSEILLE);NR;niveau7;MASTER PRO;v1.0
13512897;DROIT DES AFFAIRES (MASTER DIJON);RNCP34127;niveau7;MASTER PRO;v1.0
13512898;DROIT PUBLIC (MASTER DIJON);RNCP34084;niveau7;MASTER PRO;v1.0
13512899;DROIT PUBLIC (MASTER LORRAINE);RNCP34084;niveau7;MASTER PRO;v1.0
13513004;DIRECTION DE PROJETS OU ETABLISSEMENTS CULTURELS (MASTER BORDEAUX 3);RNCP34104;niveau7;MASTER PRO;v1.0
13513005;ARTS, LETTRES ET CIVILISATIONS (MASTER);RNCP34430;niveau7;MASTER PRO;v1.0
13513006;LETTRES ET HUMANITES (MASTER);RNCP34437;niveau7;MASTER PRO;v1.0
13513007;LETTRES (MASTER);RNCP34268;niveau7;MASTER PRO;v1.0
13513201;CREATION NUMERIQUE (MASTER);NR;niveau7;MASTER PRO;v1.0
13513301;MUSICOLOGIE (MASTER);RNCP34216;niveau7;MASTER PRO;v1.0
13513303;THEATRE (MASTER);RNCP34426;niveau7;MASTER PRO;v1.0
13513310;METIERS DE L'ENSEIGNEMENT, DE L'EDUCATION ET DE LA FORMATION (MEEF), ENCADREMENT EDUCATIF;RNCP31853;niveau7;MASTER;v1.1
13513401;CREATION NUMERIQUE (MASTER TOULON);NR;niveau7;MASTER PRO;v1.0
13513402;DESIGN (MASTER);RNCP34439;niveau7;MASTER PRO;v1.0
13513403;INDUSTRIES CULTURELLES (MASTER);NR;niveau7;MASTER PRO;v1.0
13513604;LANGUES ET SOCIETES (MASTER);RNCP31498;niveau7;MASTER PRO;v1.0
13513605;LANGUES ETRANGERES APPLIQUEES (MASTER EVRY);RNCP34101;niveau7;MASTER PRO;v1.0
13513608;LANGUES ETRANGERES APPLIQUEES (MASTER MARNE LA VALLEE);RNCP34101;niveau7;MASTER PRO;v1.0
13513610;TRADUCTION ET INTERPRETATION (MASTER STRASBOURG);RNCP34116;niveau7;MASTER PRO;v1.0
13513612;TRADUCTION ET INTERPRETATION (MASTER MARNE LA VALLEE);RNCP34116;niveau7;MASTER PRO;v1.0
13513614;LANGUES ETRANGERES APPLIQUEES (MASTER LA ROCHELLE);RNCP34101;niveau7;MASTER PRO;v1.0
13513615;LANGUES ETRANGERES APPLIQUEES ( MASTER LILLE 3);RNCP34101;niveau7;MASTER PRO;v1.0
13513616;LANGUES ETRANGERES APPLIQUEES (MASTER DIJON);RNCP34101;niveau7;MASTER PRO;v1.0
13513617;LANGUES ETRANGERES APPLIQUEES (MASTER GRENOBLE ALPES);RNCP34101;niveau7;MASTER PRO;v1.0
13513618;LANGUES ETRANGERES APPLIQUEES (MASTER PARIS 12);RNCP34101;niveau7;MASTER PRO;v1.0
13513619;LANGUES, LITTERATURES ET CIVILISATIONS ETRANGERES ET REGIONALES (MASTER);RNCP31503;niveau7;MASTER PRO;v1.0
13513620;LANGUES ETRANGERES APPLIQUEES (MASTER ORLEANS);RNCP34101;niveau7;MASTER PRO;v1.0
13513621;TRADUCTION ET INTERPRETATION (MASTER);RNCP34116;niveau7;MASTER PRO;v1.0
13513622;LANGUES ETRANGERES APPLIQUEES (MASTER CLERMONT AUVERGNE);RNCP34101;niveau7;MASTER PRO;v1.0
13513623;LANGUES ETRANGERES APPLIQUEES (MASTER);RNCP34101;niveau7;MASTER PRO;v1.0
13520001;INSTRUMENTATION, MESURE, METROLOGIE (MASTER);RNCP34118;niveau7;MASTER PRO;v1.0
13520010;GENIE DES PROCEDES ET DES BIO-PROCEDES (MASTER LORRAINE);RNCP34094;niveau7;MASTER PRO;v1.0
13520011;GENIE INDUSTRIEL (MASTER AMIENS);RNCP34113;niveau7;MASTER PRO;v1.0
13520013;GENIE INDUSTRIEL (MASTER STRASBOURG);RNCP34113;niveau7;MASTER PRO;v1.0
13520014;ENERGIE (MASTER PERPIGNAN);RNCP34438;niveau7;MASTER PRO;v1.0
13520015;ELECTRONIQUE, ENERGIE ELECTRIQUE, AUTOMATIQUE (MASTER REIMS);RNCP34117;niveau7;MASTER PRO;v1.0
13520016;GENIE INDUSTRIEL (MASTER PARIS SACLAY);RNCP34113;niveau7;MASTER PRO;v1.0
13520018;GENIE INDUSTRIEL (MASTER MARNE LA VALLEE);RNCP34113;niveau7;MASTER PRO;v1.0
13520019;INGENIERIE NUCLAIRE (MASTER);RNCP34119;niveau7;MASTER PRO;v1.0
13520021;DESIGN (MASTER BORDEAUX 3);RNCP34439;niveau7;MASTER PRO;v1.0
13520022;INGENIERIE DE CONCEPTION (MASTER);RNCP34115;niveau7;MASTER PRO;v1.0
13520023;INGENIERIE DES SYSTEMES COMPLEXES (MASTER NANTES);RNCP34026;niveau7;MASTER PRO;v1.0
13520024;INGENIERIE DES SYSTEMES COMPLEXES (MASTER);RNCP34026;niveau7;MASTER PRO;v1.0
13520025;GENIE INDUSTRIEL (MASTER);RNCP34113;niveau7;MASTER PRO;v1.0
13520026;QUALITE, HYGIENE, SECURITE (MASTER);NR;niveau7;MASTER PRO;v1.0
13520103;ELECTRONIQUE, ENERGIE ELECTRIQUE, AUTOMATIQUE (MASTER GRENOBLE ALPES);RNCP34117;niveau7;MASTER PRO;v1.0
13520104;INGENIERIE DES SYSTEMES COMPLEXES (MASTER BORDEAUX);RNCP34026;niveau7;MASTER PRO;v1.0
13520106;INGENIERIE DES SYSTEMES COMPLEXES (MASTER LORRAINE);RNCP34026;niveau7;MASTER PRO;v1.0
13520108;AUTOMATIQUE, ROBOTIQUE (MASTER);RNCP34103;niveau7;MASTER PRO;v1.0
13521002;BIOLOGIE, AGROSCIENCES (MASTER TOURS);NR;niveau7;MASTER PRO;v1.0
13521003;SCIENCES ET TECHNOLOGIES DE L'AGRICULTURE, DE L'ALIMENTATION ET DE L'ENVIRONNEMENT (MASTER CORSE);NR;niveau7;MASTER PRO;v1.0
13521004;BIOLOGIE, AGROSCIENCES (MASTER);NR;niveau7;MASTER PRO;v1.0
13521005;SCIENCES DE LA VIGNE ET DU VIN (MASTER);NR;niveau7;MASTER PRO;v1.0
13521303;AGROSCIENCES, ENVIRONNEMENT, PAYSAGE, FORET (MASTER ORLEANS);RNCP34156;niveau7;MASTER PRO;v1.1
13522003;CHIMIE ET SCIENCES DES MATERIAUX (MASTER TOURS);RNCP34112;niveau7;MASTER PRO;v1.1
13522006;GENIE DES PROCEDES ET DES BIOPROCEDES (MASTER);RNCP34094;niveau7;MASTER PRO;v1.0
