CodeDiplome;Intitulé Diplôme;CodeRNCP;Niveau2019;type Diplôme;DerniereMaJ
32032614;SERVICES INFORMATIQUES AUX ORGANISATIONS OPTION B SOLUTIONS LOGICIELLES ET APPLICATIONS METIERS (BTS);RNCP17108;niveau3;BTS;v1.1
32033001;SERVICES ET PRESTATIONS DES SECTEURS SANITAIRE ET SOCIAL (BTS);RNCP5297;niveau5;BTS;v1.0
32033103;DIETETIQUE (BTS);RNCP1045;niveau5;BTS;v1.0
32033104;PROTHESISTE ORTHESISTE (BTS);RNCP1097;niveau5;BTS;v1.0
32033105;PODO-ORTHESISTE (BTS);RNCP1088;niveau5;BTS;v1.0
32033107;OPTICIEN LUNETIER (BTS);RNCP1084;niveau5;BTS;v1.0
32033109;ANALYSES DE BIOLOGIE MEDICALE (BTS);RNCP5298;niveau5;BTS;v1.0
32033110;PROTHESISTE DENTAIRE (BTS);RNCP14957;niveau5;BTS;v1.0
32033204;ECONOMIE SOCIALE ET FAMILIALE (BTS);RNCP1047;niveau5;BTS;v1.0
32033205;CONSEILLER EN ECONOMIE SOCIALE ET FAMILIALE (DIPLÔME D'ETAT);RNCP7571;niveau5;DE;v1.0
32033420;TOURISME (BTS);RNCP14892;niveau5;BTS;v1.0
32033420;TOURISME (BTS);RNCP14892;niveau5;BTS;v1.0
32033423;MANAGEMENT EN HOTELLERIE-RESTAURATION OPTION A MANAGEMENT D'UNITE DE RESTAURATION (BTS);NR;niveau5;BTS;v1.0
32033424;MANAGEMENT EN HOTELLERIE-RESTAURATION OPTION B MANAGEMENT D'UNITE DE PRODUCTION CULINAIRE (BTS);NR;niveau5;BTS;v1.0
32033425;MANAGEMENT EN HOTELLERIE-RESTAURATION OPTION C MANAGEMENT D'UNITE D'HEBERGEMENT (BTS);NR;niveau5;BTS;v1.0
32033426;TOURISME (BTS);RNCP14892;niveau5;BTS;v1.0
32033603;METIERS DE L'ESTHETIQUE-COSMETIQUE-PARFUMERIE, OPTION A : MANAGEMENT (BTS);RNCP20693;niveau5;BTS;v1.0
32033604;METIERS DE L'ESTHETIQUE-COSMETIQUE-PARFUMERIE, OPTION B : FORMATION-MARQUES (BTS);RNCP20693;niveau5;BTS;v1.0
32033605;METIERS DE L'ESTHETIQUE-COSMETIQUE-PARFUMERIE, OPTION C : COSMETOLOGIE (BTS);RNCP20693;niveau5;BTS;v1.0
32033607;METIERS DE LA COIFFURE (BTS);RNCP20687;niveau5;BTS;v1.0
32034301;METIERS DE L'EAU (BTS);RNCP1081;niveau5;BTS;v1.0
32034303;ENVIRONNEMENT NUCLEAIRE (BTS);RNCP4586;niveau5;BAC PRO;v1.0
32034304;METIERS DES SERVICES A L'ENVIRONNEMENT (BTS);RNCP20692;niveau5;BTS;v1.0
32034401;MANAGEMENT OPERATIONNEL DE LA SECURITE (BTS);NR;niveau3;BTS;v1.1
32034501;NOTARIAT (BTS);RNCP4984;niveau5;BTS;v1.0
32113301;CINEMA D'ANIMATION (DMA);RNCP821;niveau5;DMA;v1.0
32122301;ART DU BIJOU ET DU JOYAU (DMA);RNCP819;niveau5;DMA;v1.0
32122401;TEXTILES ET CERAMIQUES OPTION : ARTS DE LA CERAMIQUE ARTISANALE (DMA);RNCP841;niveau5;DMA;v1.0
32122402;DECOR ARCHITECTURAL OPTION ARTS DU VERRE ET DU CRISTAL (DMA);RNCP5291;niveau5;DMA;v1.0
32123001;HABITAT OPTION : DECORS ET MOBILIERS (DMA);RNCP836;niveau5;DMA;v1.0
32123002;HABITAT OPTION : ORNEMENTS ET OBJETS (DMA);RNCP837;niveau5;DMA;v1.0
32123003;DECOR ARCHITECTURAL OPT.A : DOMAINE DU TRAITEMENT PLASTIQUE ET DE LA TRANSPARENCE (DMA);RNCP845;niveau5;DMA;v1.0
32123004;DECOR ARCHITECTURAL OPTION B : DOMAINE DU DECOR DU MUR (DMA);RNCP843;niveau5;DMA;v1.0
32123005;DECOR ARCHITECTURAL OPTION C : DOMAINE DU METAL (DMA);RNCP850;niveau5;DMA;v1.0
32123006;DECOR ARCHITECTURAL OPTION D : DOMAINE DES MATERIAUX DE SYNTHESE (DMA);RNCP844;niveau5;DMA;v1.0
32123409;LUTHERIE (DMA);RNCP820;niveau5;DMA;v1.0
32123410;HABITAT OPTION RESTAURATION DE MOBILIER (DMA);RNCP5293;niveau5;DMA;v1.0
32123411;FACTURE INSTRUMENTALE OPTION ACCORDEON (DMA);RNCP6899;niveau5;DMA;v1.0
32123412;FACTURE INSTRUMENTALE OPTION GUITARE (DMA);RNCP6899;niveau5;DMA;v1.0
32123413;FACTURE INSTRUMENTALE OPTION PIANO (DMA);RNCP6899;niveau5;DMA;v1.0
32124101;TEXTILES ET CERAMIQUES OPTION : ARTS TEXTILES (DMA);RNCP840;niveau5;DMA;v1.0
32124204;COSTUMIER REALISATEUR (DMA);RNCP842;niveau5;DMA;v1.0
32125101;HORLOGERIE (DMA);RNCP830;niveau5;DMA;v1.0
32125401;FACTURE INSTRUMENTALE OPTION INSTRUMENTS A VENT (DMA);RNCP6899;niveau5;DMA;v1.0
32132205;ARTS GRAPHIQUES OPTION :  GRAVURE (DMA);RNCP826;niveau5;DMA;v1.0
32132206;ARTS GRAPHIQUES OPTION : RELIURE DORURE (DMA);RNCP828;niveau5;DMA;v1.0
32132207;ARTS GRAPHIQUES OPTION : ILLUSTRATION (DMA);RNCP827;niveau5;DMA;v1.0
32132208;ARTS GRAPHIQUES OPTION : TYPOGRAPHIE (DMA);RNCP829;niveau5;DMA;v1.0
32132301;CIRQUE (DMA);NR;niveau5;DMA;v1.0
32132313;MARIONNETTE (DMA);NR;niveau5;DMA;v1.0
32132316;REGIE DU SPECTACLE OPTION LUMIERE (DMA);RNCP912;niveau5;DMA;v1.0
32132317;REGIE DU SPECTACLE OPTION SON (DMA);RNCP4000;niveau5;DMA;v1.0
32222702;MAINTENANCE NUCLEAIRE (DNTS);RNCP6929;niveau5;DNTS;v1.0
32225202;EXPERT EN AUTOMOBILE (DIPLOME);RNCP2829;niveau5;DIP3;v1.0
32233109;IMAGERIE MEDICALE ET RADIOLOGIE THERAPEUTIQUE (DIPLOME DE TECHNICIEN SUPERIEUR EN) - (DTS);RNCP2950;niveau5;DTS;v1.0
32321007;GENIE DES EQUIPEMENTS AGRICOLES (BTSA);RNCP15669;niveau5;BTSA;v1.0
32321011;DEVELOPPEMENT DE L'AGRICULTURE DES REGIONS CHAUDES (BTSA);RNCP24442;niveau5;BTSA;v1.0
32321012;SCIENCES ET TECHNOLOGIES DES ALIMENTS SPE PRODUITS CEREALIERS (BTSA);RNCP15614;niveau5;BTSA;v1.0
32321013;TECHNICO-COMMERCIAL (BTSA);RNCP4617;niveau5;BTS;v1.0
32321014;ANALYSE, CONDUITE ET STRATEGIE DE L'ENTREPRISE AGRICOLE (ACSE) (BTSA);RNCP24440;niveau5;BTSA;v1.0
32321111;PRODUCTION HORTICOLE (BTSA);RNCP4168;niveau5;BTSA;v1.0
32321112;VITICULTURE OENOLOGIE (BTSA);RNCP15616;niveau5;BTSA;v1.0
32321113;AGRONOMIE- PRODUCTIONS VEGETALES (BTSA);RNCP15611;niveau5;BTSA;v1.0
32321205;PRODUCTIONS ANIMALES (BTSA);RNCP358;niveau5;BTSA;v1.0
32321206;AQUACULTURE (BTSA);RNCP17215;niveau5;BTSA;v1.0
32321304;GESTION FORESTIERE (BTSA);RNCP15673;niveau5;BTSA;v1.0
32321308;GESTION ET PROTECTION DE LA NATURE (BTSA);RNCP15674;niveau5;BTSA;v1.0
32321401;AMENAGEMENTS PAYSAGERS (BTSA);RNCP13871;niveau5;BAC PRO;v1.0
32322111;ANALYSES AGRICOLES BIOLOGIQUES ET BIOTECHNOLOGIQUES (BTSA);RNCP15516;niveau5;BTSA;v1.0
32322112;SCIENCES ET TECHNOLOGIES DES ALIMENTS SPE PRODUITS LAITIERS (BTSA);RNCP15614;niveau5;BTSA;v1.0
32322113;SCIENCES ET TECHNOLOGIES DES ALIMENTS SPE ALIMENTS ET PROCESSUS TECHNOLOGIQUES (BTSA);RNCP15614;niveau5;BTSA;v1.0
32322114;SCIENCES ET TECHNOLOGIES DES ALIMENTS SPE VIANDES ET PRODUITS DE LA PECHE (BTSA);NR;niveau5;BTSA;v1.0
32330001;DEVELOPPEMENT, ANIMATION DES TERRITOIRES RURAUX (BTSA);RNCP15668;niveau5;BTSA;v1.0
32334302;GESTION ET MAITRISE DE L'EAU (BTSA);RNCP15672;niveau5;BTSA;v1.0
33633501;DIPLOME D'ETAT DE LA JEUNESSE, DE L'EDUCATION POPULAIRE ET DU SPORT SPE ANIMATION SOCIO-EDUCATIVE OU CULTURELLE (DE JEPS);RNCP4900;niveau5;DE;v1.0
33633502;DIPLOME D'ETAT DE LA JEUNESSE, DE L'EDUCATION POPULAIRE ET DU SPORT SPE PERFECTIONNEMENT SPORTIF (DE JEPS);RNCP4863;niveau5;DE;v1.0
34631001;ENTREPRENEUR DE PETITE ENTREPRISE (CNAM);RNCP6930;niveau5;TITRE;v1.0
34632601;TECHNICIEN(ENE) DEVELOPPEUR(EUSE) (CNAM);RNCP28754;niveau5;TITRE;v1.0
34633101;ASSISTANT(E) EN SANTE ET SECURITE AU TRAVAIL (CNAM);RNCP26779;niveau5;TITRE;v1.0
35011102;SCIENCES ET GENIE DES MATERIAUX  (DUT);RNCP2466;niveau5;DUT;v1.0
35011103;MESURES PHYSIQUES (DUT);RNCP20656;niveau3;DUT;v1.1
35011402;STATISTIQUE ET INFORMATIQUE DECISIONNELLE (DUT);RNCP20650;niveau5;DUT;v1.1
35011601;CHIMIE OPTION CHIMIE ANALYTIQUE ET DE SYNTHESE (DUT);RNCP20612;niveau5;DUT;v1.0
35011602;CHIMIE OPTION CHIMIE DES MATERIAUX (DUT);RNCP20706;niveau5;DUT;v1.0
35011806;GENIE BIOLOGIQUE OPTION ANALYSES BIOLOGIQUES ET BIOCHIMIQUES (DUT);RNCP2923;niveau5;DUT;v1.0
35011807;GENIE BIOLOGIQUE OPTION INDUSTRIES AGROALIMENTAIRES ET BIOLOGIQUES (DUT);RNCP2921;niveau5;DUT;v1.0
35011808;GENIE BIOLOGIQUE OPTION AGRONOMIE (DUT);RNCP2922;niveau5;DUT;v1.0
35011809;GENIE BIOLOGIQUE OPTION GENIE DE L ENVIRONNEMENT (DUT);RNCP2925;niveau5;DUT;v1.0
35020006;GENIE INDUSTRIEL ET MAINTENANCE GIM (DUT);RNCP2926;niveau5;DUT;v1.0
35020007;QUALITE, LOGISTIQUE INDUSTRIELLE ET ORGANISATION (DUT);RNCP20643;niveau5;DUT;v1.0
35022210;CHIMIE OPTION CHIMIE INDUSTRIELLE (DUT);RNCP20623;niveau5;DUT;v1.0
35022212;GENIE CHIMIQUE, GENIE DES PROCEDES OPTION PROCEDES (DUT);RNCP2476;niveau5;DUT;v1.0
35022213;GENIE CHIMIQUE, GENIE DES PROCEDES OPTION BIO-PROCEDES (DUT);RNCP2467;niveau5;DUT;v1.0
35022701;GENIE THERMIQUE ET ENERGIE  (DUT);RNCP2475;niveau5;DUT;v1.0
35023001;GENIE CIVIL - CONSTRUCTION DURABLE (DUT);RNCP20701;niveau5;DUT;v1.0
35025101;GENIE MECANIQUE ET PRODUCTIQUE GMP (DUT);RNCP2508;niveau5;DUT;v1.0
35025506;GENIE ELECTRIQUE ET INFORMATIQUE INDUSTRIELLE GEII (DUT);RNCP4379;niveau5;DUT;v1.0
35031001;GESTION DES ENTREPRISES ET DES ADMINISTRATIONS GEA OPTION GESTION ET MANAGEMENT DES ORGANISATIONS (DUT);RNCP20648;niveau5;DUT;v1.0
35031002;GESTION DES ENTREPRISES ET DES ADMINISTRATIONS GEA OPTION GESTION COMPTABLE ET FINANCIERE (DUT);RNCP20702;niveau5;DUT;v1.0
35031004;GESTION ADMINISTRATIVE ET COMMERCIALE  DES ORGANISATIONS (DUT);RNCP20699;niveau5;DUT;v1.0
35031102;GESTION LOGISTIQUE ET TRANSPORT (DUT);RNCP2462;niveau5;DUT;v1.0
35031103;PACKAGING EMBALLAGE ET CONDITIONNEMENT (DUT);RNCP20660;niveau5;DUT;v1.0
35031201;TECHNIQUES DE COMMERCIALISATION  (DUT);RNCP2927;niveau5;DUT;v1.0
35031202;TECHNIQUES DE COMMERCIALISATION  ORIENTATION COMMERCIALISATION DES SYSTEMES, SOLUTIONS ET SERVICES INDUSTRIELS (DUT);NR;niveau5;DUT;v1.0
35031501;GESTION DES ENTREPRISES ET DES ADMINISTRATIONS GEA OPTION GESTION DES RESSOURCES HUMAINES (DUT);RNCP20652;niveau5;DUT;v1.0
35032002;METIERS DU MULTIMEDIA ET DE L'INTERNET   (DUT);RNCP20646;niveau5;DUT;v1.0
35032003;INFORMATION COMMUNICATION OPTION COMMUNICATION DES ORGANISATIONS (DUT);RNCP20657;niveau5;DUT;v1.0
35032101;INFORMATION COMMUNICATION OPTION JOURNALISME (DUT);RNCP2687;niveau5;DUT;v1.0
35032102;INFORMATION COMMUNICATION OPTION PUBLICITE (DUT);RNCP2689;niveau5;DUT;v1.0
35032202;INFORMATION COMMUNICATION OPTION METIERS DU LIVRE ET DU PATRIMOINE(DUT);RNCP2688;niveau5;DUT;v1.0
35032502;INFORMATION COMMUNICATION OPTION INFORMATION NUMERIQUE DANS LES ORGANISATIONS (DUT);RNCP20640;niveau5;DUT;v1.0
35032605;INFORMATIQUE (DUT);RNCP20654;niveau5;DUT;v1.0
35032608;RESEAUX ET TELECOMMUNICATIONS (DUT);RNCP20649;niveau5;DUT;v1.0
35033003;CARRIERES SOCIALES OPTION SERVICES A LA PERSONNE (DUT);RNCP29211;niveau5;DUT;v1.0
35033102;GENIE BIOLOGIQUE OPTION DIETETIQUE (DUT);RNCP2924;niveau5;DUT;v1.0
35033103;AIDE ET ASSISTANCE POUR LE MONITORING ET LE MAINTIEN À DOMICILE (2A2M);RNCP7487;niveau5;DUT;v1.0
35033201;CARRIERES SOCIALES OPTION EDUCATION SPECIALISEE (DUT);RNCP2479;niveau5;DUT;v1.0
35033202;CARRIERES SOCIALES OPTION ASSISTANCE SOCIALE (DUT);RNCP2480;niveau5;DUT;v1.0
35033203;CARRIERES SOCIALES OPTION GESTION URBAINE (DUT);RNCP2478;niveau5;DUT;v1.0
35033505;CARRIERES SOCIALES OPTION ANIMATION SOCIALE ET SOCIO-CULTURELLE (DUT);RNCP2481;niveau5;DUT;v1.0
35034403;HYGIENE SECURITE ENVIRONNEMENT (DUT);RNCP2729;niveau5;DUT;v1.0
35034501;CARRIERES JURIDIQUES  (DUT);RNCP2541;niveau5;DUT;v1.0
3551180B;BIO-INDUSTRIES ET BIOTECHNOLOGIES (DEUST PARIS 11);NR;niveau5;DEUST;v1.0
3552000A;SYSTEMES D'INFORMATION, NUMERIQUE ET ELECTRONIQUE (DEUST PARIS 6);NR;niveau5;DEUST;v1.0
35522101;PRODUCTION ET TRANSFORMATION SPECIALITE ARTS ET METIERS DE BOUCHE (DEUST CNAM);RNCP23012;niveau5;DEUST;v1.0
35522201;ANALYSE DES MILIEUX BIOLOGIQUES (DEUST CORSE);RNCP3972;niveau5;DEUST;v1.0
3552220C;PRODUCTION, CONTROLE ET QUALITE DES PRODUITS DE SANTE (DEUST BORDEAUX);RNCP27038;niveau5;DEUST;v1.0
35523001;BATIMENT ET CONSTRUCTION (DEUST LITTORAL);RNCP34443;niveau5;DEUST;v1.0
35523201;MAINTENANCE HOTELIERE HOSPITALIERE ET IMMOBILIERE (DEUST ANGERS);RNCP2869;niveau5;DEUST;v1.0
35523202;BATIMENT ET CONSTRUCTION SPE CONDUITE DE TRAVAUX EN ECO-CONSTRUCTION (DEUST CNAM);RNCP22990;niveau5;DEUST;v1.0
35532101;TECHNICIEN DES MEDIAS INTERACTIFS ET COMMUNICANTS (DEUST T-MIC);RNCP24358;niveau5;Autre;v1.0
35532401;BUREAUTIQUE ET COMMUNICATION MULTIMEDIA (DEUST UNIV DU LITTORAL);RNCP3973;niveau5;DEUST;v1.0
3553260B;SYSTEMES D'INFORMATION ET RESEAUX, GESTION ET DEVELOPPEMENT (DEUST PARIS 2);RNCP21529;niveau5;DEUST;v1.0
3553260B;SYSTEMES D'INFORMATION ET RESEAUX, GESTION ET DEVELOPPEMENT (DEUST PARIS 2);RNCP2876;niveau5;DEUST;v1.0
3553320A;TRAVAIL SOCIAL, METIERS DE L'AMENAGEMENT ET DES ACTIVITES SOCIALES (MAAS) ECONOMIE SOCIALE ET SOLIDAIRE (ESS) (DEUST EVRY);NR;niveau5;DEUST;v1.0
35533401;ACCUEIL D'EXCELLENCE EN TOURISME (DEUST ANGERS);RNCP20309;niveau5;DEUST;v1.0
35533501;METIERS DE LA FORME (DEUST LYON 1);RNCP2690;niveau5;DEUST;v1.0
35533502;ANIMATION ET GESTION DES ACTIVITES PHYSIQUES ET SPORTIVES OU CULTURELLES (DEUST DIJON);RNCP4709;niveau5;DEUST;v1.0
35533503;ANIMATION ET GESTION DES ACTIVITES PHYSIQUES ET SPORTIVES OU CULTURELLES (DEUST LYON 1);RNCP4709;niveau5;DEUST;v1.0
35533504;METIERS DE LA FORME (DEUST STRASBOURG);RNCP2690;niveau5;DEUST;v1.0
35533505;SPORT ADAPTE, ACTIVITES PYSIQUES ADAPTEES : DEFICIENTS INTELLECTUELS,TROUBLES PSYCHIQUES (DEUST STRASBOURG);RNCP2529;niveau5;DEUST;v1.0
35533507;METIERS DE LA FORME (DEUST TOULOUSE 3);RNCP2690;niveau5;DEUST;v1.0
35533508;STAPS:ANIMATION ET GESTION DES ACTIVITES PHYSIQUES, SPORTIVES OU CULTURELLES (DEUST CLERMONT AUVERGNE);NR;niveau5;DEUST;v1.0
35533509;ANIMATION ET COMMERCIALISATION DES SERVICES SPORTIFS (DEUST CERGY);RNCP2527;niveau5;DEUST;v1.0
35533510;STAPS:ANIMATION ET GESTION DES ACTIVITES PHYSIQUES, SPORTIVES OU CULTURELLES (DEUST BESANCON);RNCP30176;niveau5;DEUST;v1.0
35533511;STAPS:ANIMATION ET GESTION DES ACTIVITES PHYSIQUES, SPORTIVES OU CULTURELLES (DEUST LILLE);RNCP30176;niveau5;DEUST;v1.0
36013302;PROFESSEUR DE DANSE (DIPLOME D'ETAT);RNCP13866;niveau5;DE;v1.0
36022201;BIOPHYSICIEN DE LABORATOIRE (DIPLÔME);NR;niveau5;DIV-3;v1.0
36022301;PHYSICO-METALLOGRAPHE DE LABORATOIRE (DIPLÔME);NR;niveau5;DIV-3;v1.0
36023101;CONDUCTEUR DES TRAVAUX PUBLICS ET TECHNICIEN DE BUREAU D'ETUDES (DIPLOME DE L'ECOLE SPECIALE DES TRAVAUX PUBLIC ESTP);RNCP4868;niveau5;DIP3;v1.0
36023201;CONDUCTEUR TECHNICIEN DES TRAVAUX DU BATIMENT (DIPLOME DE L'ECOLE SPECIALE DES TRAVAUX PUBLIC ESTP);RNCP4869;niveau5;DIP3;v1.0
36033105;PUERICULTRICE;NR;niveau5;DIV-3;v1.0
36033107;PREPARATEUR EN PHARMACIE HOSPITALIERE (DIPLOME D'ETAT);RNCP230;niveau5;DIV-3;v1.0
36033110;PSYCHOMOTRICIEN (DIPLOME D'ETAT);RNCP4861;niveau5;DE;v1.0
36033112;AUDIOPROTHESISTE (DIPLOME D'ETAT);NR;niveau5;DIV-2;v1.0
36033113;TECHNICIEN DE LABORATOIRE MEDICAL (DIPLOME D'ETAT);NR;niveau5;DIV-2;v1.0
36033205;ASSISTANT DE SERVICE SOCIAL (DIPLOME D'ETAT);RNCP2517;niveau5;DE;v1.0
36033206;EDUCATEUR SPECIALISE (DIPLOME D'ETAT);RNCP2348;niveau5;DE;v1.0
36033207;EDUCATEUR DE JEUNES ENFANTS (DIPLOME D'ETAT);RNCP4501;niveau5;DE;v1.0
36033208;EDUCATEUR TECHNIQUE SPECIALISE (DIPLOME D'ETAT);RNCP4502;niveau5;DE;v1.0
36321002;HYDRAULIQUE AGRICOLE (CSA);RNCP2277;niveau3;CSA NIV3;v1.1
36321004;RESPONSABLE TECHNICO COMMERCIAL  EN AGROEQUIPEMENT;RNCP2286;niveau5;CS;v1.0
36321005;TECHNICIEN CONSEIL EN SYSTEMES INFORMATISES APPLIQUES A L'AGRICULTURE (CSA);RNCP2302;niveau5;CS;v1.0
36321006;VENTE A L'EXPORTATION DES PRODUITS AGRICOLES ET AGROALIMENTAIRES (CSA);NR;niveau5;CSA NIV3;v1.0
36321007;RESPONSABLE TECHNICO COMMERCIAL EN AGROFOURNITURES (CSA);RNCP2285;niveau5;CS;v1.0
36321102;TECHNIQUES D'AGRICULTURE BIOLOGIQUE (CSA);RNCP2295;niveau5;CSA NIV3;v1.0
36321103;TECHNICIEN CONSEIL EN AGRICULTURE BIOLOGIQUE (CSA);RNCP2295;niveau5;CS;v1.0
36321104;RESPONSABLE TECHNICO COMMERCIAL : HORTICULTURE ORNEMENTALE (CSA);RNCP2288;niveau5;CS;v1.0
36321105;RESPONSABLE TECHNICO COMMERCIAL : FRUITS ET LEGUMES (CSA);RNCP2287;niveau5;CS;v1.0
36321106;GESTION DES ARBRES D'ORNEMENT (CSA);RNCP2276;niveau5;CS;v1.0
36321204;AUTOMATISME ET GESTION TECHNICO-ECONOMIQUE INFORMATISEE EN ELEVAGE LAITIER (CSA);NR;niveau5;CSA NIV3;v1.0
36321205;TECHNICIEN CONSEIL EN PRODUCTION LAITIERE (CSA);RNCP2299;niveau5;CS;v1.0
36321206;TECHNICIEN CONSEIL EN PRODUCTION PORCINE (CSA);RNCP2301;niveau5;CS;v1.0
36321207;TECHNICIEN ANIMATEUR QUALITE EN ENTREPRISE VITI VINICOLE (CSA);RNCP2293;niveau5;CS;v1.0
36321208;TECHNICIEN CONSEIL EN PRODUCTION LAITIERE OVINE (CSA);RNCP2300;niveau5;CS;v1.0
36321209;TECHNICIEN CONSEIL EN PRODUCTION AVICOLE (CSA);RNCP2298;niveau5;CS;v1.0
36321210;TECHNICIEN CONSEIL EN PRODUCTION CAPRINE (CSA);RNCP2289;niveau5;CS;v1.0
36321211;RESPONSABLE TECHNICO COMMERCIAL : PRODUITS CARNES (CSA);RNCP2290;niveau5;CS;v1.0
36321212;TECHNICIEN CONSEIL EN BATIMENTS D'ELEVAGE ET AGRICOLES (CSA);RNCP4100;niveau5;CS;v1.0
36321302;AGRICULTURE ET AMENAGEMENT RURAL DES ZONES DE MONTAGNE ET DEFAVORISEES (CSA);NR;niveau5;CSA NIV3;v1.0
36321401;COLLABORATEUR DU CONCEPTEUR PAYSAGISTE (CSA);RNCP2262;niveau5;CS;v1.0
36322101;SPECIALISTE EN GESTION ET PROMOTION DE LA QUALITE DES PRODUITS DE LA FILIERE LAIT (CSA);NR;niveau5;CSA NIV3;v1.0
36322104;RESPONSABLE TECHNICO-COMMERCIAL DES ENTREPRISES AGRICOLES PARA-AGRICOLES ET AGRO-ALIMENTAIRES (CSA);RNCP2284;niveau5;CSA NIV3;v1.0
36322104;RESPONSABLE TECHNICO-COMMERCIAL DES ENTREPRISES AGRICOLES PARA-AGRICOLES ET AGRO-ALIMENTAIRES (CSA);RNCP2285;niveau5;CSA NIV3;v1.0
36322104;RESPONSABLE TECHNICO-COMMERCIAL DES ENTREPRISES AGRICOLES PARA-AGRICOLES ET AGRO-ALIMENTAIRES (CSA);RNCP2286;niveau5;CSA NIV3;v1.0
36322107;AUTOMATISATION DANS L'INDUSTRIE LAITIERE ET AGROALIMENTAIRE (CSA);RNCP2259;niveau5;CS;v1.0
36322108;TECHNICIEN CONSEIL DANS LES ENTREPRISES D'AMONT DE LA FILIERE VIANDE (CSA);RNCP2297;niveau5;CSA NIV3;v1.0
36322109;FROMAGERIE INTERNATIONALE (CSA);RNCP2275;niveau5;CS;v1.0
36322110;RESPONSABLE DE FROMAGERIE EN FABRICATION TRADITIONNELLE (CSA);RNCP2282;niveau5;CS;v1.0
36322111;RESPONSABLE TECHNICO-COMMERCIAL EN INDUSTRIES AGRO-ALIMENTAIRES : PRODUITS LAITIERS (CSA);RNCP2284;niveau5;CS;v1.0
36331201;RESPONSABLE TECHNICO COMMERCIAL EN VINS ET PRODUITS DERIVES : ORIENTATION COMMERCE (CSA);RNCP2291;niveau5;CS;v1.0
36331202;RESPONSABLE TECHNICO COMMERCIAL EN VINS ET PRODUITS DERIVES : ORIENTATION PRODUIT (CSA);RNCP2292;niveau5;CS;v1.0
36331403;TECHNICIEN CONSEIL EN COMPTABILITE ET GESTION AGRICOLES (CSA);RNCP2296;niveau5;CS;v1.0
36421204;CONSEILLER D'ELEVAGE AVICOLE (AVIPOLE FORMATION);RNCP4028;niveau5;TITRE;v1.0
36421301;CHEF DE PRODUITS FORET BOIS (CFPPA DE CROGNY);RNCP1563;niveau5;TITRE;v1.0
36A21301;TECHNICIEN(NE) DU GENIE ECOLOGIQUE (CFPPA ANGERS LE FRESNE);RNCP28107;niveau5;TITRE;v1.0
36C20001;CHARGE DE PROJET CAO ET PLM (CCI COLMAR CENTRE ALSACE);RNCP27336;niveau5;TITRE;v1.1
36C22201;ASSISTANT(E) TECHNIQUE DES LABORATOIRES PARFUM COSMETIQUE ET AROMES (CCIP IDF ISIPCA);RNCP26923;niveau5;TITRE;v1.0
36C25501;TECHNICIEN DE BUREAU D'ETUDES RESEAUX NUMERIQUES (CCIT MANCHE FIM NOVEA);RNCP30365;niveau5;TITRE;v1.0
36C31101;DECLARANT EN DOUANE (CCI ET CAUX);RNCP9092;niveau5;TITRE;v1.0
36C3120D;CHARGE DE LA GESTION ET DE L'ACTIVITE COMMERCIALE DE L'ENTREPRISE (CCI SEINE ET MARNE);RNCP13573;niveau5;TITRE;v1.0
36C3120G;ATTACHE(E) COMMERCIAL(E) (CCI FRANCE - RESEAU NEGOVENTIS);RNCP27413;niveau5;TITRE;v1.0
36C3120J;GESTIONNAIRE COMMERCIAL, SPECIALISE SPORT (CNPC SPORT LOISIRS);RNCP27012;niveau5;TITRE;v1.0
36C3120V;GESTIONNAIRE D'UNITE COMMERCIALE, OPTION GENERALISTE - OPTION SPECIALISEE (CCI FRANCE - RESEAU NEGOVENTIS);RNCP23827;niveau5;TITRE;v1.0
36C3120W;DECORATEUR MERCHANDISEUR (CCI FRANCE - RESEAU ESDC);RNCP23872;niveau5;TITRE;v1.0
36C3130A;NEGOCIATEUR GESTIONNAIRE IMMOBILIER (CCI LIMOGES);RNCP20434;niveau5;TITRE;v1.0
36C3150A;ASSISTANT DE GESTION ET RECRUTEMENT (CCI PARIS IDF, SUP DE VENTE,CCI LYON METROPOLE ST ETIENNE ROANNE, ESMAE);RNCP30355;niveau5;TITRE;v1.0
36C3150B;ASSISTANT(E) EN RESSOURCES HUMAINES (CCI FRANCE - RESEAU ESMASS);RNCP27095;niveau5;TITRE;v1.0
36C32201;GRAPHISTE EN COMMUNICATION MULTICANAL (CCI HAUTS DE FRANCE);RNCP29811;niveau5;TITRE;v1.0
36C32401;ASSISTANT JURIDIQUE (CCI SEINE SUR MER NORMANDIE);RNCP6933;niveau5;TITRE;v1.0
36C3240B;ASSISTANT(E) DE DIRECTION (CCI FRANCE - RESEAU ESMASS);RNCP23937;niveau5;TITRE;v1.0
36C32601;CHARGE D'EXPLOITATION EN RESEAUX ET TELECOMS (CCI ET CAUX);RNCP19542;niveau5;TITRE;v1.0
36C32603;DEVELOPPEUR INTEGRATEUR DE SOLUTIONS INTRANET EXTRANET (CCI FRANCE - RESEAU ESI);RNCP16615;niveau5;TITRE;v1.0
36C3260A;ANALYSTE DEVELOPPEUR D'APPLICATIONS INFORMATIQUES (CCI FRANCE - RESEAU ESI);RNCP28669;niveau5;TITRE;v1.0
36C33401;ASSISTANT MANAGER TOURISME HOTELLERIE RESTAURATION (CCI FRANCE - RESEAU NEGOVENTIS);RNCP23870;niveau5;TITRE;v1.0
36C33402;AGENT DE COMPTOIR EN TOURISME (CCI TARBES);RNCP22979;niveau5;TITRE;v1.0
36E25501;TECHNICIEN DE MAINTENANCE DU PARC EOLIEN ON SHORE (LYCEE DHUODAT GRETA NIME);RNCP29392;niveau5;TITRE;v1.0
36E33201;CONSEILLER EMPLOI FORMATION INSERTION (GIP FCIP);RNCP6571;niveau3;TH3-E;v1.1
36K3230A;REGISSEUR (SSEUSE) LUMIERE (CFPTS);RNCP27344;niveau5;TITRE;v1.1
36M21101;FLEURISTE (BM APCMA);RNCP7419;niveau5;TITRE;v1.0
36M22101;PATISSIER CONFISEUR GLACIER TRAITEUR (BM APCMA);RNCP9084;niveau5;TITRE;v1.0
36M22102;BOULANGER (BM APCMA);RNCP9824;niveau5;TITRE;v1.0
36M22103;BOUCHER-CHARCUTIER-TRAITEUR (BM APCMA);RNCP19184;niveau5;TITRE;v1.0
36M22701;TECHNICIEN EN SYSTEMES DE GENIE CLIMATIQUE : OPTIONS INSTALLATEUR DE SYSTEMES ET MAINTENANCE EN SYSTEMES (BTM);RNCP20270;niveau5;TITRE;v1.0
36M22702;INSTALLATEUR SANITAIRE (BM APCMA);RNCP27104;niveau5;TITRE;v1.0
36M23001;RAMONEUR (BM);RNCP29387;niveau5;TITRE;v1.0
36M23201;TAILLEUR DE PIERRE (BTMS APCMA);RNCP4687;niveau5;TITRE;v1.0
36M23202;COUVREUR-ZINGUEUR (BTM APCMA);RNCP19355;niveau5;TITRE;v1.0
36M23401;EBENISTE (BTMS APCMA);RNCP23653;niveau5;TITRE;v1.0
36M23402;MENUISIER DE BATIMENT ET D'AGENCEMENT (BM APCMA);RNCP13592;niveau5;TITRE;v1.0
36M23403;PEINTRE EN BATIMENT (BM APCMA);RNCP18136;niveau5;TITRE;v1.0
36M25501;INSTALLATEUR EN EQUIPEMENTS ELECTRIQUES (BM APCMA);RNCP34414;niveau5;TITRE;v1.0
36M33101;PROTHESISTE DENTAIRE (BTMS APCMA);RNCP1465;niveau5;TITRE;v1.0
36M33401;TRAITEUR-ORGANISATEUR DE RECEPTION (BM APCMA);RNCP15078;niveau5;TITRE;v1.0
36M33601;COIFFEUR (BM APCMA);RNCP6253;niveau5;TITRE;v1.0
36M33602;ESTHETICIEN(NE) COSMETICIEN(NE) (BM APCMA);RNCP12306;niveau5;TITRE;v1.0
36N2000A;CHARGE DE GESTION TECHNIQUE DES BATIMENTS TERTIAIRES ET INDUSTRIELS (IRUP);RNCP6917;niveau5;TITRE;v1.0
36N3260B;DEVELOPPEUR(EUSE) INTEGRATEUR(TRICE) DE MEDIAS INTERACTIFS (ASSOC CAMPUS FONDERIE DE L'IMAGE);RNCP27347;niveau5;TITRE;v1.1
36Q2300A;RESPONSABLE TECHNIQUE EN BATIMENT ET DES TRAVAUX PUBLICS (CCI GRENOBLE-ISCO);RNCP16190;niveau5;TITRE;v1.0
36Q33401;VENDEUR(SE) CONSEIL EN VOYAGE D'AFFAIRES ET DE TOURISME (AFT-IFTIM);RNCP22928;niveau5;TITRE;v1.0
36R2010A;CHARGE DES SYSTEMES NUMERIQUES INDUSTRIELS (IRUP);RNCP30701;niveau5;TITRE;v1.0
36R3130A;CHARGE DE CLIENTELE EN ASSURANCES DE PERSONNES ET PRODUITS FINANCIERS (SOGESTE GROUPE ESCCOT);RNCP30392;niveau5;TITRE;v1.1
36R3130A;CHARGE DE CLIENTELE EN ASSURANCES DE PERSONNES ET PRODUITS FINANCIERS (SOGESTE GROUPE ESCCOT);RNCP30392;niveau5;TITRE;v1.1
36R3130A;CHARGE DE CLIENTELE EN ASSURANCES DE PERSONNES ET PRODUITS FINANCIERS (SOGESTE GROUPE ESCCOT);RNCP30392;niveau5;TITRE;v1.1
36R3130A;CHARGE DE CLIENTELE EN ASSURANCES DE PERSONNES ET PRODUITS FINANCIERS (SOGESTE GROUPE ESCCOT);RNCP30392;niveau5;TITRE;v1.1
36S2220B;TECHNICIEN SUPERIEUR EN PHARMACIE ET COSMETOLOGIE INDUSTRIELLES (GROUPE IMT);RNCP12811;niveau5;TITRE;v1.0
36S33201;COORDINATEUR DE L'INTERVENTION SOCIALE ET PROFESSIONNELLE (CENTRE RESSOURCES AROBASE);RNCP16575;niveau5;TITRE;v1.0
36T20001;TECHNICIEN(NE) SUPERIEUR(E) EN PRODUCTION INDUSTRIELLE (TP);RNCP13948;niveau5;TP;v1.0
36T20101;TECHNICIEN(NE) SUPERIEUR(E) DE MAINTENANCE INDUSTRIELLE (TP);RNCP2469;niveau5;TP;v1.0
36T20102;TECHNICIEN(NE) SUPERIEUR(E) EN AUTOMATIQUE ET INFORMATIQUE INDUSTRIELLE (TP);RNCP1876;niveau5;TP;v1.0
36T20103;TECHNICIEN(NE) SUPERIEUR(E) EN GESTION INDUSTRIELLE (TP);RNCP4963;niveau5;TP;v1.0
36T22201;TECHNICIEN SUPERIEUR PHYSICIEN CHIMISTE (TP);RNCP1878;niveau5;TP;v1.0
36T22701;TECHNICIEN SUPERIEUR D'ETUDES EN GENIE CLIMATIQUE (TP);RNCP1828;niveau5;TP;v1.0
36T2270A;TECHNICIEN SUPERIEUR DE MAINTENANCE ET D'EXPLOITATION EN CLIMATIQUE (TP);RNCP25982;niveau5;TP;v1.0
36T23001;TECHNICIEN SUPERIEUR DU BATIMENT EN ECONOMIE DE LA CONSTRUCTION (TP);RNCP1272;niveau5;TP;v1.0
36T23002;CONDUCTEUR DE TRAVAUX DU BATIMENT ET DU GENIE CIVIL (TP);RNCP28811;niveau5;TP;v1.0
36T23003;CONDUCTEUR DE TRAVAUX PUBLICS ROUTE, CANALISATION, TERRASSEMENT (TP);RNCP34283;niveau5;TP;v1.1
36T23004;COORDINATEUR BIM DU BATIMENT (TP);RNCP34280;niveau3;TH3-T;v1.1
36T23101;TECHNICIEN SUPERIEUR GEOMETRE TOPOGRAPHE OPTION GEOMETRE ET TRAVAUX PUBLICS (TP);RNCP1829;niveau5;TP;v1.0
36T23102;TECHNICIEN SUPERIEUR EN SYSTEME D'INFORMATION GEOGREPAHIQUE (TP);RNCP5301;niveau5;TP;v1.0
36T23201;CHEF DE CHANTIER GROS OEUVRE (TP);RNCP1863;niveau5;TP;v1.0
36T23202;CHARGE D'AFFAIRES EN BATIMENTS (TP);RNCP12492;niveau5;TP;v1.0
36T23203;CHARGE D'AFFAIRES EN RENOVATION ENERGETIQUE DU BATIMENT (TP);RNCP34158;niveau5;TP;v1.1
36T23204;DESSINATEUR PROJETEUR EN BETON ARME (TP);RNCP9579;niveau5;TP;v1.0
36T23301;CONDUCTEUR DE TRAVAUX AMENAGEMENT FINITIONS (TP);RNCP1796;niveau5;TP;v1.0
36T25101;TECHNICIEN(NE) SUPERIEUR(E) METHODES PRODUIT PROCESS (TP);RNCP7159;niveau5;TP;v1.0
36T25102;TECHNICIEN SUPERIEUR EN CONCEPTION INDUSTRIELLE DE SYSTEMES MECANIQUES (TP);RNCP5891;niveau5;TH3-T;v1.0
36T31001;RESPONSABLE DE PETITE OU MOYENNE STRUCTURE (TP);RNCP27596;niveau5;TP;v1.0
36T3110A;TECHNICIEN SUPERIEUR EN METHODES ET EXPLOITATION LOGISTIQUE (TP);RNCP1901;niveau5;TP;v1.0
36T3110C;TECHNICIEN(NE) SUPERIEUR(E) DES TRANSPORTS DE PERSONNES (TP);RNCP34372;niveau5;TP;v1.1
36T3110D;TECHNICIEN(NE) SUPERIEUR(E) DU TRANSPORT TERRESTRE DE MARCHANDISES (TP);RNCP23623;niveau5;TP;v1.0
36T3110E;TECHNICIEN(NE) SUPERIEUR(E) DU TRANSPORT AERIEN ET MARITIME DE MARCHANDISES (TP);RNCP23624;niveau5;TP;v1.0
36T31201;MANAGER D'UNITE MARCHANDE (TP);RNCP32291;niveau5;TP;v1.0
36T31202;ASSISTANT(E) IMPORT-EXPORT BILINGUE ANGLAIS (TP);RNCP10013;niveau5;TP;v1.0
36T31203;NEGOCIATEUR (TRICE) TECHNICO-COMMERCIAL (TP);RNCP34079;niveau5;TP;v1.1
36T31204;ETALAGISTE DECORATEUR MERCHANDISEUR (CNPH);RNCP26158;niveau5;TITRE;v1.0
36T31401;GESTIONNAIRE COMPTABLE ET FISCAL (TP);RNCP31677;niveau5;TP;v1.0
36T31501;GESTIONNAIRE DE PAIE (TP);RNCP4113;niveau5;TP;v1.0
36T31502;ASSISTANT(E) RESSOURCES HUMAINES (TP);RNCP6161;niveau5;TP;v1.0
36T32201;DESIGNER WEB (TP);RNCP26602;niveau5;TP;v1.0
36T32301;MONTEUR GRAPHISTE VIDEO (TP);RNCP5213;niveau5;TH3-T;v1.0
36T32401;ASSISTANTE DE DIRECTION (TP);RNCP34143;niveau5;TP;v1.0
36T32402;ASSISTANTE(T) COMMERCIAL(E) (TP);RNCP6150;niveau5;TP;v1.0
36T32403;ASSISTANT IMMMOBILIER (TP);RNCP34441;niveau3;TH3-T;v1.1
